{
  "schemaVersion": 1,
  "id": "checklist-complete",
  "label": "Markdown checklist complete",
  "description": "All checkbox items are checked and the checklist output is not older than a required earlier output.",
  "placementPhaseInput": "artifact",
  "inputs": [
    {
      "id": "artifact",
      "type": "artifact",
      "label": "Checklist output"
    },
    {
      "id": "prerequisite",
      "type": "artifact",
      "label": "Earlier output"
    }
  ],
  "textPlaceholders": [],
  "adapter": "badge-rule-content-adapter"
}
